{"copy":{"curiosityHook":"With no memory of his real past, can the stranded agent untangle his identity before the conspirators who betrayed him close in?","description":"After a corrupt CIA agent causes a devastating helicopter crash in South Africa, an amnesiac commando is nursed by a local tribe and must piece together his forgotten identity alongside an enigmatic reporter.","vibeSummary":"Fast, exciting, and lightly comic, delivering brisk action-adventure thrills with an engaging mystery.","whyWatch":"Directed by Jackie Chan and Benny Chan, this fast-paced action-comedy combines globe-trotting intrigue and physical stunts with lighthearted suspense that keeps you engaged."},"movie":{"candidateId":"scale500-tmdb-8697","tmdbId":8697},"promptVersion":"editorial-writer.v1","schemaVersion":"editorial-output.v1","voiceGuideVersion":"voice.v2","writerNotes":{"spoilerBoundary":{"allowedMaterial":["corrupt CIA agent Morgan causes helicopter crash in South Africa","sole survivor suffers severe amnesia and is nursed by a native tribe who call him Whoami","hero teams up with reporter Christine to uncover his past and hunt the turncoat","genres: action, adventure, comedy, thriller"],"excludedMaterial":["ultimate fate of Morgan or his cohorts","specific true identity revelations","third-act stunts and climactic confrontations","resolutions of Christine's motives"],"sourceRefs":["tmdb-facts","tmdb-overview"]}}}
