{"copy":{"curiosityHook":"Can 007 thwart Largo's atomic scheme before time runs out, especially once the villain's vengeful girlfriend Domino enters the fray?","description":"Secret agent James Bond returns to action when the nefarious organization SPECTRE steals two atomic warheads. Tasked with stopping the mastermind Largo, 007 must navigate a high-stakes scheme of global nuclear blackmail.","vibeSummary":"Exciting and suspenseful spy adventure with fast pacing, globe-trotting stakes, and engaged action suited for friends.","whyWatch":"Directed by Irvin Kershner, this globetrotting 1983 spy thriller delivers fast-paced action, classic espionage tension, and an entangled alliance fueled by personal revenge."},"movie":{"candidateId":"scale500-tmdb-36670","tmdbId":36670},"promptVersion":"editorial-writer.v1","schemaVersion":"editorial-output.v1","voiceGuideVersion":"voice.v2","writerNotes":{"spoilerBoundary":{"allowedMaterial":["James Bond returning as secret agent 007","Confrontation with the evil organization SPECTRE","Largo stealing two atomic warheads for nuclear blackmail","Domino being Largo's girlfriend, falling for Bond, and seeking revenge","Director Irvin Kershner and 1983 release context"],"excludedMaterial":["Resolution of the nuclear blackmail threat","Third-act confrontations and final battle outcomes","Fate of Largo or Domino","Specific late-plot reversals or death scenes"],"sourceRefs":["tmdb-facts","tmdb-overview"]}}}
