{"copy":{"curiosityHook":"Can Asterix's transatlantic rescue mission outwit Caesar's imperial legions before Roman rule overruns Britain?","description":"When Julius Caesar launches an invasion of Britain, Asterix journeys across the channel to back up his second-cousin Anticlimax in a high-spirited comedic clash against the occupying Roman forces.","vibeSummary":"Funny, light, and comfortably paced adventure comedy built for an entertaining, low-demand family night.","whyWatch":"Laurent Tirard directs a colorful, lighthearted comic adaptation packed with slapstick action and breezy period adventure that hits the sweet spot for an easy family watch."},"movie":{"candidateId":"scale500-tmdb-99770","tmdbId":99770},"promptVersion":"editorial-writer.v1","schemaVersion":"editorial-output.v1","voiceGuideVersion":"voice.v2","writerNotes":{"spoilerBoundary":{"allowedMaterial":["Asterix crosses the channel","Assisting second-cousin Anticlimax","Confronting Julius Caesar and invading Roman legions","Adventure, comedy, and family genre context","Laurent Tirard directing"],"excludedMaterial":["Climactic battle results","Defeat or victory outcomes for Caesar","Late-film relationship resolutions","Third-act plot twists and ending"],"sourceRefs":["tmdb-facts","tmdb-overview"]}}}
