{"copy":{"curiosityHook":"United by family ties and fueled by vengeance, how long can these outlaw brothers outrun the law as their raids grow increasingly perilous?","description":"Driven by revenge, Jesse James, Cole Younger, and their bands of brothers launch a daring campaign of legendary bank robberies across the frontier in Walter Hill's historical western.","vibeSummary":"Fast-paced and exciting frontier crime, balancing suspenseful shootouts with moderate dramatic weight for solo or group viewing.","whyWatch":"Walter Hill infuses classic frontier outlaw lore with kinetic action, brisk momentum, and a grounded focus on brotherly loyalty pushed to the brink."},"movie":{"candidateId":"scale500-tmdb-14729","tmdbId":14729},"promptVersion":"editorial-writer.v1","schemaVersion":"editorial-output.v1","voiceGuideVersion":"voice.v2","writerNotes":{"spoilerBoundary":{"allowedMaterial":["James gang origins and revenge motive","Jesse James and Cole Younger sibling relationships","Legendary bank raid premise and frontier crime setting","Walter Hill direction and western genre framing"],"excludedMaterial":["Ultimate fate of specific gang members","Northfield raid outcome or specific ambush details","Betrayals or later deaths"],"sourceRefs":["tmdb-facts","tmdb-overview"]}}}
