{"copy":{"curiosityHook":"Elle readily accepts the advances of an obsessed mechanic, but the real mystery is the concealed purpose driving her into his life.","description":"After moving to a small French village, Elle strikes up a romance with Pin-Pon, an infatuated local mechanic. But beneath the summer heat, she harbors a calculating, personal motive of her own.","vibeSummary":"A steady, emotionally heavy French crime drama fueled by quiet obsession and simmering suspense, best absorbed in focused solo viewing.","whyWatch":"Jean Becker directs a simmering, character-driven French mystery that blends small-town drama with psychological tension and an undercurrent of lingering, heavy stakes."},"movie":{"candidateId":"scale500-tmdb-9041","tmdbId":9041},"promptVersion":"editorial-writer.v1","schemaVersion":"editorial-output.v1","voiceGuideVersion":"voice.v2","writerNotes":{"spoilerBoundary":{"allowedMaterial":["Elle Wieck moves to a small French village","Pin-Pon is a quiet young mechanic obsessed with Elle","Elle starts dating Pin-Pon","Elle harbors an ulterior motive for the relationship","Small-town French setting and summer atmosphere"],"excludedMaterial":["Elle's specific hidden past or family history","Details of the underlying crime or rape trauma","Eventual revenge targets or murder outcomes","Third-act revelations and ending"],"sourceRefs":["tmdb-facts","tmdb-overview"]}}}
