{"copy":{"curiosityHook":"As MacLeod faces his own mortality, what lingering secret from planet Zeist brings General Katana across worlds to finish him off?","description":"Now mortal and nearing the end of his life, Connor MacLeod is haunted by resurfacing memories of the planet Zeist, just as his vengeful old enemy, General Katana, plots his ultimate destruction.","vibeSummary":"Fast-paced, suspenseful sci-fi fantasy with exciting action, moderate emotional stakes, and energetic spectacle perfect for friends.","whyWatch":"Director Russell Mulcahy takes the fantasy saga into bold science-fiction territory, delivering fast-moving action and high-stakes adventure with persistent suspense."},"movie":{"candidateId":"exp100-tmdb-8010","tmdbId":8010},"promptVersion":"editorial-writer.v1","schemaVersion":"editorial-output.v1","voiceGuideVersion":"voice.v2","writerNotes":{"spoilerBoundary":{"allowedMaterial":["Connor MacLeod is mortal and an old man near death","Resurfacing memories of his past on planet Zeist","General Katana is a vengeful enemy plotting to destroy him","Director Russell Mulcahy","Genre blend of fantasy, action, adventure, and science fiction"],"excludedMaterial":["Details of the shield or environmental plot not present in packet","Outcome of Katana's attack","Return of past allies or specific resurrection mechanisms","Resolution of MacLeod's mortality or fate"],"sourceRefs":["tmdb-facts","tmdb-overview"]}}}
