{"copy":{"curiosityHook":"What begins as an uneasy confrontation shifts the moment Valentine catches the reclusive judge secretly wiretapping private neighborhood conversations.","description":"After accidentally injuring a dog, part-time model Valentine meets its detached owner, a retired judge. When she discovers he routinely eavesdrops on his neighbors, an improbable connection begins to form.","vibeSummary":"Thoughtful, deliberate, and emotionally resonant French drama laced with quiet, voyeuristic mystery.","whyWatch":"Director Krzysztof Kieślowski crafts an intimate, slow-burning drama that folds quiet suspense and genuine emotional warmth into an unconventional moral encounter."},"movie":{"candidateId":"scale500-tmdb-110","tmdbId":110},"promptVersion":"editorial-writer.v1","schemaVersion":"editorial-output.v1","voiceGuideVersion":"voice.v2","writerNotes":{"spoilerBoundary":{"allowedMaterial":["Valentine running over the dog and keeping it","The retired judge's initial indifference","The discovery of the judge eavesdropping on his neighbors' phone calls","The emergence of an unlikely bond between the two characters"],"excludedMaterial":["Content or consequences of the intercepted phone calls","Later developments involving the neighbors","Late relationship progression and resolutions","Third-act events or conclusion"],"sourceRefs":["tmdb-facts","tmdb-overview"]}}}
